occupation,education,education_years
"School Psychologists","Master's degree",22.0
"Search Marketing Strategists","Bachelor's degree",21.0
"Secondary School Teachers, Except Special and Career/Technical Education","Bachelor's degree",21.0
"Secretaries and Administrative Assistants, Except Legal, Medical, and Executive","High school diploma or equivalent",17.0
"Securities, Commodities, and Financial Services Sales Agents","Bachelor's degree",21.0
"Security Guards","High school diploma or equivalent",17.0
"Security and Fire Alarm Systems Installers","High school diploma or equivalent",17.0
"Segmental Pavers","High school diploma or equivalent",17.0
"Self-Enrichment Teachers","High school diploma or equivalent",17.0
"Semiconductor Processing Technicians","High school diploma or equivalent",17.0
"Separating, Filtering, Clarifying, Precipitating, and Still Machine Setters, Operators, and Tenders","High school diploma or equivalent",17.0
"Septic Tank Servicers and Sewer Pipe Cleaners","High school diploma or equivalent",17.0
"Service Unit Operators, Oil and Gas","No formal educational credential",14.0
"Set and Exhibit Designers","Bachelor's degree",21.0
"Sewers, Hand","No formal educational credential",14.0
"Sewing Machine Operators","No formal educational credential",14.0
Shampooers,"No formal educational credential",14.0
"Sheet Metal Workers","High school diploma or equivalent",17.0
"Ship Engineers","Postsecondary nondegree award",18.5
"Shipping, Receiving, and Inventory Clerks","High school diploma or equivalent",17.0
"Shoe Machine Operators and Tenders","High school diploma or equivalent",17.0
"Shoe and Leather Workers and Repairers","High school diploma or equivalent",17.0
"Signal and Track Switch Repairers","High school diploma or equivalent",17.0
"Skincare Specialists","Postsecondary nondegree award",18.5
"Slaughterers and Meat Packers","No formal educational credential",14.0
"Social Science Research Assistants","Bachelor's degree",21.0
"Social Work Teachers, Postsecondary","Doctoral or professional degree",22.0
"Social and Community Service Managers","Bachelor's degree",21.0
"Social and Human Service Assistants","High school diploma or equivalent",17.0
Sociologists,"Master's degree",22.0
"Sociology Teachers, Postsecondary","Doctoral or professional degree",22.0
"Software Quality Assurance Analysts and Testers","Bachelor's degree",21.0
"Soil and Plant Scientists","Bachelor's degree",21.0
"Solar Energy Installation Managers","High school diploma or equivalent",17.0
"Solar Energy Systems Engineers","Bachelor's degree",21.0
"Solar Photovoltaic Installers","High school diploma or equivalent",17.0
"Solar Sales Representatives and Assessors","Bachelor's degree",21.0
"Solar Thermal Installers and Technicians","High school diploma or equivalent",17.0
"Sound Engineering Technicians","Postsecondary nondegree award",18.5
"Spa Managers","Postsecondary nondegree award",18.5
"Special Education Teachers, Middle School","Bachelor's degree",21.0
"Special Education Teachers, Preschool","Bachelor's degree",21.0
"Special Education Teachers, Secondary School","Bachelor's degree",21.0
"Special Effects Artists and Animators","Bachelor's degree",21.0
"Speech-Language Pathologists","Master's degree",22.0
"Speech-Language Pathology Assistants","High school diploma or equivalent",17.0
"Sports Medicine Physicians","Doctoral or professional degree",22.0
"Stationary Engineers and Boiler Operators","High school diploma or equivalent",17.0
"Statistical Assistants","Bachelor's degree",21.0
Statisticians,"Master's degree",22.0
"Stockers and Order Fillers","High school diploma or equivalent",17.0
"Stone Cutters and Carvers, Manufacturing","High school diploma or equivalent",17.0
Stonemasons,"High school diploma or equivalent",17.0
"Structural Iron and Steel Workers","High school diploma or equivalent",17.0
"Structural Metal Fabricators and Fitters","High school diploma or equivalent",17.0
"Substance Abuse and Behavioral Disorder Counselors","Master's degree",22.0
"Subway and Streetcar Operators","High school diploma or equivalent",17.0
"Supply Chain Managers","High school diploma or equivalent",17.0
"Surgical Assistants","Postsecondary nondegree award",18.5
"Surgical Technologists","Postsecondary nondegree award",18.5
"Survey Researchers","Master's degree",22.0
"Surveying and Mapping Technicians","High school diploma or equivalent",17.0
Surveyors,"Bachelor's degree",21.0
"Sustainability Specialists","Bachelor's degree",21.0
"Switchboard Operators, Including Answering Service","High school diploma or equivalent",17.0
"Tailors, Dressmakers, and Custom Sewers","No formal educational credential",14.0
"Talent Directors","Bachelor's degree",21.0
"Tank Car, Truck, and Ship Loaders","No formal educational credential",14.0
Tapers,"No formal educational credential",14.0
"Tax Examiners and Collectors, and Revenue Agents","Bachelor's degree",21.0
"Tax Preparers","High school diploma or equivalent",17.0
"Teaching Assistants, Postsecondary","Bachelor's degree",21.0
"Team Assemblers","High school diploma or equivalent",17.0
"Technical Writers","Bachelor's degree",21.0
"Telecommunications Engineering Specialists","Bachelor's degree",21.0
"Telecommunications Equipment Installers and Repairers, Except Line Installers","Postsecondary nondegree award",18.5
"Telecommunications Line Installers and Repairers","High school diploma or equivalent",17.0
Telemarketers,"No formal educational credential",14.0
"Telephone Operators","High school diploma or equivalent",17.0
Tellers,"High school diploma or equivalent",17.0
"Terrazzo Workers and Finishers","High school diploma or equivalent",17.0
"Textile Bleaching and Dyeing Machine Operators and Tenders","High school diploma or equivalent",17.0
"Textile Cutting Machine Setters, Operators, and Tenders","High school diploma or equivalent",17.0
"Textile Knitting and Weaving Machine Setters, Operators, and Tenders","High school diploma or equivalent",17.0
"Textile Winding, Twisting, and Drawing Out Machine Setters, Operators, and Tenders","High school diploma or equivalent",17.0
"Tile and Stone Setters","No formal educational credential",14.0
"Timing Device Assemblers and Adjusters","High school diploma or equivalent",17.0
"Tire Builders","High school diploma or equivalent",17.0
"Tire Repairers and Changers","High school diploma or equivalent",17.0
"Title Examiners, Abstractors, and Searchers","High school diploma or equivalent",17.0
"Tool Grinders, Filers, and Sharpeners","High school diploma or equivalent",17.0
"Tool and Die Makers","Postsecondary nondegree award",18.5
"Tour Guides and Escorts","Postsecondary nondegree award",18.5
"Traffic Technicians","High school diploma or equivalent",17.0
"Training and Development Managers","Bachelor's degree",21.0
"Training and Development Specialists","Bachelor's degree",21.0
"Transit and Railroad Police","High school diploma or equivalent",17.0
"Transportation Engineers","Bachelor's degree",21.0
"Transportation Inspectors","High school diploma or equivalent",17.0
"Transportation Planners","Bachelor's degree",21.0
"Transportation Security Screeners","High school diploma or equivalent",17.0
"Transportation Vehicle, Equipment and Systems Inspectors, Except Aviation","High school diploma or equivalent",17.0
"Transportation, Storage, and Distribution Managers","High school diploma or equivalent",17.0
"Travel Agents","High school diploma or equivalent",17.0
"Travel Guides","Postsecondary nondegree award",18.5
"Treasurers and Controllers","Bachelor's degree",21.0
"Tree Trimmers and Pruners","High school diploma or equivalent",17.0
Tutors,"Bachelor's degree",21.0
"Umpires, Referees, and Other Sports Officials","High school diploma or equivalent",17.0
Upholsterers,"High school diploma or equivalent",17.0
"Urban and Regional Planners","Master's degree",22.0
Urologists,"Doctoral or professional degree",22.0
"Ushers, Lobby Attendants, and Ticket Takers","No formal educational credential",14.0
"Validation Engineers","Bachelor's degree",21.0
Veterinarians,"Doctoral or professional degree",22.0
"Veterinary Assistants and Laboratory Animal Caretakers","High school diploma or equivalent",17.0
"Veterinary Technologists and Technicians","Associate's degree",19.0
"Video Game Designers","Bachelor's degree",21.0
"Waiters and Waitresses","No formal educational credential",14.0
"Watch and Clock Repairers","High school diploma or equivalent",17.0
"Water Resource Specialists","Bachelor's degree",21.0
"Water and Wastewater Treatment Plant and System Operators","High school diploma or equivalent",17.0
"Water/Wastewater Engineers","Bachelor's degree",21.0
"Weatherization Installers and Technicians","High school diploma or equivalent",17.0
"Web Administrators","Bachelor's degree",21.0
"Web Developers","Postsecondary nondegree award",18.5
"Weighers, Measurers, Checkers, and Samplers, Recordkeeping","High school diploma or equivalent",17.0
"Welders, Cutters, Solderers, and Brazers","High school diploma or equivalent",17.0
"Welding, Soldering, and Brazing Machine Setters, Operators, and Tenders","High school diploma or equivalent",17.0
"Wellhead Pumpers","High school diploma or equivalent",17.0
"Wholesale and Retail Buyers, Except Farm Products","Postsecondary nondegree award",18.5
"Wind Energy Development Managers","Bachelor's degree",21.0
"Wind Energy Engineers","Bachelor's degree",21.0
"Wind Energy Operations Managers","Postsecondary nondegree award",18.5
"Wind Turbine Service Technicians","Postsecondary nondegree award",18.5
"Woodworking Machine Setters, Operators, and Tenders, Except Sawing","High school diploma or equivalent",17.0
"Word Processors and Typists","High school diploma or equivalent",17.0
"Writers and Authors","Bachelor's degree",21.0
"Zoologists and Wildlife Biologists","Bachelor's degree",21.0
